Question,Expected Output,Answer (Query)
46. Invoice Details: Join Invoices and Customers to list invoices with customer names.,"invoice_id = 2701, customer_name = ""Rachel Adams"""," SELECT Invoices.invoice_id, Customers.name FROM Invoices INNER JOIN Customers ON Invoices.customer_id = Customers.id;"
47. Course Instructors: Show courses and their instructors.,"course_name = ""Advanced Python"", instructor_name = ""Dr. Mark Jones"""," SELECT Courses.course_name, Instructors.instructor_name FROM Courses INNER JOIN Instructors ON Courses.instructor_id = Instructors.id;"
48. Warranty Claims: Retrieve warranty claims and associated products.,"claim_id = 2801, product_name = ""Coffee Maker"", claim_date = ""2024-08-02"""," SELECT WarrantyClaims.claim_id, Products.product_name, WarrantyClaims.claim_date FROM WarrantyClaims INNER JOIN Products ON WarrantyClaims.product_id = Products.id;"
49. Product Orders: Join Orders and Products to list orders and their product names.,"order_id = 2901, product_name = ""Wireless Mouse"""," SELECT Orders.order_id, Products.product_name FROM Orders INNER JOIN Products ON Orders.product_id = Products.id;"
50. Workshop Attendees: Show workshops and attendees' names.,"workshop_name = ""Digital Marketing"", attendee_name = ""Paul Green"""," SELECT Workshops.name, Attendees.name FROM Attendees INNER JOIN Workshops ON Attendees.workshop_id = Workshops.id;"
51. Sales Regions: List sales and the regions they were made in.,"sale_id = 3001, region = ""West Coast"""," SELECT Sales.sale_id, Regions.region_name FROM Sales INNER JOIN Regions ON Sales.region_id = Regions.id;"
52. Book Authors: Retrieve book titles and their authors.,"book_title = ""1984"", author_name = ""George Orwell"""," SELECT Books.title, Authors.name FROM Books INNER JOIN Authors ON Books.author_id = Authors.id;"
53. Training Sessions: Combine Sessions and Trainers to show sessions and their trainers.,"session_name = ""Leadership Skills"", trainer_name = ""John Smith"""," SELECT Sessions.session_name, Trainers.trainer_name FROM Sessions INNER JOIN Trainers ON Sessions.trainer_id = Trainers.id;"
54. Patient Appointments: List appointments with patient names and doctors.,"appointment_id = 3101, patient_name = ""Lisa Wong"", doctor_name = ""Dr. Lee"""," SELECT Appointments.appointment_id, Patients.name, Doctors.name FROM Appointments INNER JOIN Patients ON Appointments.patient_id = Patients.id INNER JOIN Doctors ON Appointments.doctor_id = Doctors.id;"
55. Subscription Plans: Show subscriptions with plan details.,"subscription_id = 3201, plan_name = ""Premium"", cost = ""$19.99"""," SELECT Subscriptions.subscription_id, Plans.plan_name, Plans.cost FROM Subscriptions INNER JOIN Plans ON Subscriptions.plan_id = Plans.id;"
56. Movie Ratings: Retrieve movies and their ratings.,"movie_title = ""The Matrix"", rating = ""4.8"""," SELECT Movies.title, Ratings.rating FROM Movies INNER JOIN Ratings ON Movies.id = Ratings.movie_id;"
57. Vendor Products: List products and their vendors.,"product_name = ""Tablet"", vendor_name = ""TechWorld"""," SELECT Products.product_name, Vendors.vendor_name FROM Products INNER JOIN Vendors ON Products.vendor_id = Vendors.id;"
58. Delivery Addresses: Join Deliveries and Addresses to show delivery details with addresses.,"delivery_id = 3301, address = ""456 Oak St"""," SELECT Deliveries.delivery_id, Addresses.address FROM Deliveries INNER JOIN Addresses ON Deliveries.address_id = Addresses.id;"
59. Course Assignments: Show courses with assigned instructors.,"course_name = ""Database Systems"", instructor_name = ""Dr. Johnson"""," SELECT Courses.course_name, Instructors.instructor_name FROM Courses INNER JOIN Instructors ON Courses.instructor_id = Instructors.id;"
60. Purchase Orders: Retrieve purchase orders with supplier details.,"purchase_order_id = 3401, supplier_name = ""Office Supplies Co."""," SELECT PurchaseOrders.purchase_order_id, Suppliers.supplier_name FROM PurchaseOrders INNER JOIN Suppliers ON PurchaseOrders.supplier_id = Suppliers.id;"
61. Task Assignments: List tasks and the employees assigned to them.,"task_id = 3501, employee_name = ""Sandra Miller"""," SELECT Tasks.task_id, Employees.name FROM Tasks INNER JOIN Employees ON Tasks.employee_id = Employees.id;"
62. Product Categories: Join Products and Categories to list products with their categories.,"product_name = ""Air Conditioner"", category_name = ""Home Appliances"""," SELECT Products.product_name, Categories.category_name FROM Products INNER JOIN Categories ON Products.category_id = Categories.id;"
63. Rental Services: Show rentals and the service providers.,"rental_id = 3601, provider_name = ""QuickRent"""," SELECT Rentals.rental_id, ServiceProviders.provider_name FROM Rentals INNER JOIN ServiceProviders ON Rentals.provider_id = ServiceProviders.id;"
64. Membership Levels: List memberships with their level details.,"membership_id = 3701, level_name = ""Gold"", benefits = ""Free shipping"""," SELECT Memberships.membership_id, Levels.level_name, Levels.benefits FROM Memberships INNER JOIN Levels ON Memberships.level_id = Levels.id;"
65. Invoice Payments: Combine Invoices and Payments to show invoices with payment details.,"invoice_id = 3801, payment_amount = ""$120.00"""," SELECT Invoices.invoice_id, Payments.amount FROM Invoices INNER JOIN Payments ON Invoices.payment_id = Payments.id;"
66. Hotel Rooms: Retrieve room details and their types.,"room_id = 3901, room_type = ""Suite"""," SELECT Rooms.room_id, RoomTypes.room_type FROM Rooms INNER JOIN RoomTypes ON Rooms.room_type_id = RoomTypes.id;"
67. User Activities: Show user activities and their descriptions.,"user_id = 4001, activity_description = ""Login"""," SELECT Users.user_id, Activities.description FROM UserActivities INNER JOIN Activities ON UserActivities.activity_id = Activities.id;"
68. Supplier Contacts: List suppliers and their contact information.,"supplier_name = ""GreenTech"", contact_info = ""555-1234"""," SELECT Suppliers.supplier_name, Contacts.contact_info FROM Suppliers INNER JOIN Contacts ON Suppliers.contact_id = Contacts.id;"
69. Job Openings: Join Jobs and Departments to show job openings with department names.,"job_id = 4101, department_name = ""Engineering"""," SELECT Jobs.job_id, Departments.department_name FROM Jobs INNER JOIN Departments ON Jobs.department_id = Departments.id;"
70. Software Licenses: Retrieve software licenses and their types.,"license_id = 4201, license_type = ""Enterprise"""," SELECT Licenses.license_id, LicenseTypes.license_type FROM Licenses INNER JOIN LicenseTypes ON Licenses.license_type_id = LicenseTypes.id;"
71. Author Books: Join Books and Authors to list each book with its author.,"book_title = ""The Great Gatsby"", author_name = ""F. Scott Fitzgerald"""," SELECT Books.title, Authors.name FROM Books INNER JOIN Authors ON Books.author_id = Authors.id;"
72. Employee Projects: Show employees and the projects they are working on.,"employee_name = ""Alice Carter"", project_name = ""Website Redesign"""," SELECT Employees.name, Projects.project_name FROM Employees INNER JOIN Projects ON Employees.project_id = Projects.id;"
73. Membership Benefits: List membership plans with their benefits.,"membership_id = 4301, plan_name = ""Silver"", benefits = ""10% discount"""," SELECT Memberships.membership_id, Plans.plan_name, Plans.benefits FROM Memberships INNER JOIN Plans ON Memberships.plan_id = Plans.id;"
74. Service Orders: Retrieve service orders and their associated services.,"service_order_id = 4401, service_name = ""Cleaning"""," SELECT ServiceOrders.service_order_id, Services.service_name FROM ServiceOrders INNER JOIN Services ON ServiceOrders.service_id = Services.id;"
75. Customer Feedback: Show customer feedback with product details.,"feedback_id = 4501, product_name = ""Smartphone"", feedback = ""Excellent"""," SELECT Feedback.feedback_id, Products.product_name, Feedback.comments FROM Feedback INNER JOIN Products ON Feedback.product_id = Products.id;"
76. Course Materials: Combine Courses and Materials to list courses with their materials.,"course_name = ""Machine Learning"", material_name = ""Lecture Notes"""," SELECT Courses.name, Materials.material_name FROM Courses INNER JOIN Materials ON Courses.material_id = Materials.id;"
77. Job Applicants: Retrieve job applicants with their respective job postings.,"applicant_name = ""Ethan Adams"", job_title = ""Marketing Manager"""," SELECT Applicants.name, Jobs.job_title FROM Applicants INNER JOIN Jobs ON Applicants.job_id = Jobs.id;"
78. Product Discounts: Show products and their discount rates.,"product_name = ""Washing Machine"", discount_rate = ""15%"""," SELECT Products.product_name, Discounts.discount_rate FROM Products INNER JOIN Discounts ON Products.discount_id = Discounts.id;"
79. Rental Agreements: List rental agreements with the tenants' names.,"agreement_id = 4601, tenant_name = ""Emily Brown"""," SELECT RentalAgreements.agreement_id, Tenants.name FROM RentalAgreements INNER JOIN Tenants ON RentalAgreements.tenant_id = Tenants.id;"
80. Patient Prescriptions: Combine Prescriptions and Doctors to show prescriptions with doctor details.,"prescription_id = 4701, doctor_name = ""Dr. Harris"""," SELECT Prescriptions.prescription_id, Doctors.name FROM Prescriptions INNER JOIN Doctors ON Prescriptions.doctor_id = Doctors.id;"
81. Supplier Orders: Show orders and their suppliers.,"order_id = 4801, supplier_name = ""Food Supply Co."""," SELECT Orders.order_id, Suppliers.supplier_name FROM Orders INNER JOIN Suppliers ON Orders.supplier_id = Suppliers.id;"
82. Employee Benefits: Retrieve employees and their benefit plans.,"employee_name = ""Rachel Green"", benefit_plan = ""Health Insurance"""," SELECT Employees.name, BenefitPlans.plan_name FROM Employees INNER JOIN BenefitPlans ON Employees.benefit_plan_id = BenefitPlans.id;"
83. Delivery Locations: List deliveries with their destination locations.,"delivery_id = 4901, location = ""789 Pine St"""," SELECT Deliveries.delivery_id, Locations.location_name FROM Deliveries INNER JOIN Locations ON Deliveries.location_id = Locations.id;"
84. Training Programs: Show training programs with their trainers.,"training_program_name = ""Leadership Essentials"", trainer_name = ""Michael Johnson"""," SELECT TrainingPrograms.name, Trainers.name FROM TrainingPrograms INNER JOIN Trainers ON TrainingPrograms.trainer_id = Trainers.id;"
85. Event Locations: Retrieve events and their locations.,"event_name = ""Tech Conference"", location = ""Convention Center"""," SELECT Events.name, Locations.location_name FROM Events INNER JOIN Locations ON Events.location_id = Locations.id;"
86. Customer Orders: List orders with customer names and order amounts.,"order_id = 5001, customer_name = ""Linda White"", order_amount = ""$250.00"""," SELECT Orders.order_id, Customers.name, Orders.amount FROM Orders INNER JOIN Customers ON Orders.customer_id = Customers.id;"
87. Product Reviews: Combine Products and Reviews to show product reviews with ratings.,"product_name = ""Electric Kettle"", review_rating = ""4 stars"""," SELECT Products.product_name, Reviews.rating FROM Reviews INNER JOIN Products ON Reviews.product_id = Products.id;"
88. Maintenance Requests: Show maintenance requests with their statuses.,"request_id = 5101, status = ""Completed"""," SELECT MaintenanceRequests.request_id, Statuses.status_name FROM MaintenanceRequests INNER JOIN Statuses ON MaintenanceRequests.status_id = Statuses.id;"
89. Subscription Services: List subscriptions and their service details.,"subscription_id = 5201, service_name = ""Online Storage"""," SELECT Subscriptions.subscription_id, Services.service_name FROM Subscriptions INNER JOIN Services ON Subscriptions.service_id = Services.id;"
90. Shipment Tracking: Retrieve shipments with tracking information.,"shipment_id = 5301, tracking_number = ""1Z9999999999999999"""," SELECT Shipments.shipment_id, TrackingInfo.tracking_number FROM Shipments INNER JOIN TrackingInfo ON Shipments.tracking_id = TrackingInfo.id;"
91. Staff Meetings: List meetings with their staff attendees.,"meeting_id = 5401, staff_name = ""George Harris"""," SELECT Meetings.meeting_id, Staff.name FROM Meetings INNER JOIN Staff ON Meetings.staff_id = Staff.id;"
92. Rental Equipment: Show rental agreements with equipment details.,"rental_id = 5501, equipment_name = ""Laptop"""," SELECT RentalAgreements.rental_id, Equipment.name FROM RentalAgreements INNER JOIN Equipment ON RentalAgreements.equipment_id = Equipment.id;"
93. Service Feedback: Retrieve feedback with service details.,"feedback_id = 5601, service_name = ""Home Cleaning"", feedback_comments = ""Very satisfied"""," SELECT Feedback.feedback_id, Services.service_name, Feedback.comments FROM Feedback INNER JOIN Services ON Feedback.service_id = Services.id;"
94. Membership Transactions: List transactions with membership details.,"transaction_id = 5701, membership_type = ""Gold"", amount = ""$200.00"""," SELECT Transactions.transaction_id, Memberships.membership_type, Transactions.amount FROM Transactions INNER JOIN Memberships ON Transactions.membership_id = Memberships.id;"
95. Purchase Returns: Show purchase returns with product details.,"return_id = 5801, product_name = ""Office Chair"", return_reason = ""Defective"""," SELECT Returns.return_id, Products.product_name, Returns.reason FROM Returns INNER JOIN Products ON Returns.product_id = Products.id;"
96. Product Inventory: Combine Inventory and Products to list inventory levels with product names.,"inventory_id = 5901, product_name = ""Desk Lamp"", quantity_in_stock = 20"," SELECT Inventory.inventory_id, Products.product_name, Inventory.quantity FROM Inventory INNER JOIN Products ON Inventory.product_id = Products.id;"
97. Employee Shifts: List shifts and the employees assigned to them.,"shift_id = 6001, employee_name = ""Julia Roberts"", shift_time = ""09:00 - 17:00"""," SELECT Shifts.shift_id, Employees.name, Shifts.shift_time FROM Shifts INNER JOIN Employees ON Shifts.employee_id = Employees.id;"
98. Product Orders: Show orders with product names and quantities.,"order_id = 6101, product_name = ""Electric Drill"", quantity = 3"," SELECT Orders.order_id, Products.product_name, Orders.quantity FROM Orders INNER JOIN Products ON Orders.product_id = Products.id;"
99. Subscription Renewals: Retrieve subscription renewals with their plan details.,"renewal_id = 6201, plan_name = ""Standard"", renewal_date = ""2024-08-10"""," SELECT Renewals.renewal_id, Plans.plan_name, Renewals.renewal_date FROM Renewals INNER JOIN Plans ON Renewals.plan_id = Plans.id;"
100. Project Budgets: Show projects with their budget information.,"project_name = ""Website Revamp"", budget = ""$10,000"""," SELECT Projects.project_name, Budgets.amount FROM Projects INNER JOIN Budgets ON Projects.budget_id = Budgets.id;"
101. Customer Support Tickets: List support tickets with customer names.,"ticket_id = 6301, customer_name = ""Nancy Evans"", issue = ""Login problem"""," SELECT SupportTickets.ticket_id, Customers.name, SupportTickets.issue FROM SupportTickets INNER JOIN Customers ON SupportTickets.customer_id = Customers.id;"
102. Supplier Contacts: Combine suppliers with their contact information.,"supplier_name = ""Grocery Supply Inc."", contact_name = ""John Doe"""," SELECT Suppliers.supplier_name, Contacts.contact_name FROM Suppliers INNER JOIN Contacts ON Suppliers.contact_id = Contacts.id;"
103. Training Enrollment: Retrieve training sessions and enrolled participants.,"session_id = 6401, participant_name = ""Laura Smith"""," SELECT TrainingSessions.session_id, Participants.name FROM Enrollments INNER JOIN TrainingSessions ON Enrollments.session_id = TrainingSessions.id INNER JOIN Participants ON Enrollments.participant_id = Participants.id;"
104. Service Providers: List service providers and their service types.,"provider_name = ""Elite Services"", service_type = ""Plumbing"""," SELECT ServiceProviders.provider_name, Services.service_type FROM ServiceProviders INNER JOIN Services ON ServiceProviders.service_id = Services.id;"
105. Invoice Items: Show invoices with item details.,"invoice_id = 6501, item_description = ""Office Desk"", amount = ""$300.00"""," SELECT Invoices.invoice_id, InvoiceItems.item_description, InvoiceItems.amount FROM Invoices INNER JOIN InvoiceItems ON Invoices.id = InvoiceItems.invoice_id;"
106. Warehouse Locations: Retrieve warehouse locations and their addresses.,"warehouse_id = 6601, address = ""100 Industrial Park"""," SELECT Warehouses.warehouse_id, Addresses.address FROM Warehouses INNER JOIN Addresses ON Warehouses.address_id = Addresses.id;"
107. Patient Appointments: Show patient appointments with doctor names.,"appointment_id = 6701, patient_name = ""Michael Taylor"", doctor_name = ""Dr. Patel"""," SELECT Appointments.appointment_id, Patients.name, Doctors.name FROM Appointments INNER JOIN Patients ON Appointments.patient_id = Patients.id INNER JOIN Doctors ON Appointments.doctor_id = Doctors.id;"
108. Job Candidates: List job postings with candidate names.,"job_id = 6801, candidate_name = ""Samantha Clark"""," SELECT Jobs.job_id, Candidates.name FROM JobApplications INNER JOIN Jobs ON JobApplications.job_id = Jobs.id INNER JOIN Candidates ON JobApplications.candidate_id = Candidates.id;"
109. Supplier Orders: Combine supplier orders with their products.,"order_id = 6901, product_name = ""Cleaning Supplies"", order_amount = ""$500.00"""," SELECT SupplierOrders.order_id, Products.product_name, SupplierOrders.order_amount FROM SupplierOrders INNER JOIN Products ON SupplierOrders.product_id = Products.id;"
110. Course Enrollment: Show enrolled students and their courses.,"student_name = ""Emma Wilson"", course_name = ""Data Science 101"""," SELECT Enrollments.student_name, Courses.course_name FROM Enrollments INNER JOIN Courses ON Enrollments.course_id = Courses.id;"
111. Conference Sessions: Retrieve conference sessions and their speakers.,"session_id = 7001, speaker_name = ""Dr. Martin King"""," SELECT Sessions.session_id, Speakers.name FROM Sessions INNER JOIN Speakers ON Sessions.speaker_id = Speakers.id;"
112. Inventory Management: Show inventory items with their suppliers.,"inventory_id = 7101, item_name = ""Laptop Stand"", supplier_name = ""Tech Essentials"""," SELECT Inventory.inventory_id, InventoryItems.item_name, Suppliers.supplier_name FROM Inventory INNER JOIN InventoryItems ON Inventory.item_id = InventoryItems.id INNER JOIN Suppliers ON InventoryItems.supplier_id = Suppliers.id;"
113. Employee Leave: List leave requests with employee names and leave dates.,"leave_id = 7201, employee_name = ""James Carter"", leave_date = ""2024-09-01"""," SELECT LeaveRequests.leave_id, Employees.name, LeaveRequests.leave_date FROM LeaveRequests INNER JOIN Employees ON LeaveRequests.employee_id = Employees.id;"
114. Shipping Details: Show shipping records with product details.,"shipping_id = 7301, product_name = ""Smartphone"", shipping_status = ""Shipped"""," SELECT ShippingRecords.shipping_id, Products.product_name, ShippingRecords.status FROM ShippingRecords INNER JOIN Products ON ShippingRecords.product_id = Products.id;"
115. Feedback Surveys: Retrieve survey feedback with respondent names.,"survey_id = 7401, respondent_name = ""Kevin Jones"", feedback_score = ""8/10"""," SELECT Surveys.survey_id, Respondents.name, Surveys.feedback_score FROM Surveys INNER JOIN Respondents ON Surveys.respondent_id = Respondents.id;"
116. Library Loans: List library books with loan details.,"loan_id = 7501, book_title = ""The Catcher in the Rye"", loan_date = ""2024-08-05"""," SELECT Loans.loan_id, Books.title, Loans.loan_date FROM Loans INNER JOIN Books ON Loans.book_id = Books.id;"
117. Vendor Services: Show services provided by vendors.,"vendor_name = ""Tech Solutions"", service_name = ""IT Support"""," SELECT Vendors.vendor_name, Services.service_name FROM Vendors INNER JOIN Services ON Vendors.service_id = Services.id;"
118. Product Returns: Retrieve product returns and their reasons.,"return_id = 7601, product_name = ""Washing Machine"", return_reason = ""Defective"""," SELECT ProductReturns.return_id, Products.product_name, ProductReturns.reason FROM ProductReturns INNER JOIN Products ON ProductReturns.product_id = Products.id;"
119. Event Schedules: Show events and their scheduled times.,"event_id = 7701, event_name = ""Annual Meeting"", scheduled_time = ""2024-09-15 10:00 AM"""," SELECT Events.event_id, Events.event_name, Events.scheduled_time FROM Events;"
120. Appointment Types: Combine Appointments and AppointmentTypes to show appointment types with details.,"appointment_id = 7801, appointment_type = ""Consultation"", details = ""Initial consultation for new patients"""," SELECT Appointments.appointment_id, AppointmentTypes.type_name, AppointmentTypes.details FROM Appointments INNER JOIN AppointmentTypes ON Appointments.appointment_type_id = AppointmentTypes.id;"
53. What are the differences between SQL and NoSQL databases?,"SQL is structured with fixed schemas, while NoSQL is flexible with dynamic schemas.",-
54. How do you list all columns in a table?,"column1, column2, column3",SELECT COLUMN_NAME FROM INFORMATION_SCHEMA.COLUMNS WHERE TABLE_NAME = 'table_name';
55. How do you retrieve unique values from a column?,"value1, value2",SELECT DISTINCT column_name FROM table_name;
56. How do you calculate the total number of orders for each product?,"product_id = 101, order_count = 50","SELECT product_id, COUNT(order_id) as order_count FROM orders GROUP BY product_id;"
57. How do you find the average transaction value for each customer?,"customer_id = 305, avg_transaction_value = 250","SELECT customer_id, AVG(amount) as avg_transaction_value FROM transactions GROUP BY customer_id;"
58. How do you find the highest-paid employee in each department?,"department_id = 403, max_salary = 120000","SELECT department_id, MAX(salary) as max_salary FROM employees GROUP BY department_id;"
59. How do you get the first and last order date for each customer?,"customer_id = 308, first_order_date = '2023-01-01', last_order_date = '2023-08-01'","SELECT customer_id, MIN(order_date) as first_order_date, MAX(order_date) as last_order_date FROM orders GROUP BY customer_id;"
60. How do you find all customers who have placed exactly three orders?,customer_id = 609,SELECT customer_id FROM orders GROUP BY customer_id HAVING COUNT(order_id) = 3;
61. How do you find the most recent transaction for each account?,"account_id = 707, transaction_date = '2023-08-07'","SELECT account_id, MAX(transaction_date) as most_recent_transaction FROM transactions GROUP BY account_id;"
62. How do you find employees who joined the company in 2023?,"employee_id = 412, join_date = '2023-04-01'",SELECT * FROM employees WHERE YEAR(join_date) = 2023;
63. How do you update a column value based on a condition?,Rows updated,UPDATE table_name SET column_name = new_value WHERE condition;
64. How do you find products with no sales in the last year?,product_id = 503,SELECT product_id FROM products WHERE product_id NOT IN (SELECT DISTINCT product_id FROM sales WHERE YEAR(sale_date) = 2023);
65. How do you calculate the percentage of orders delivered on time?,percentage_on_time = 85.0,SELECT (COUNT(*) FILTER (WHERE delivery_date <= estimated_delivery_date) / COUNT(*)) * 100 as percentage_on_time FROM orders;
66. How do you retrieve the top 3 most profitable products?,"product_id = 603, profit = 50000","SELECT product_id, SUM(profit) as profit FROM sales GROUP BY product_id ORDER BY profit DESC LIMIT 3;"
67. How do you find the average number of days between transactions for each account?,"account_id = 805, avg_days_between_transactions = 15","SELECT account_id, AVG(DATEDIFF(LEAD(transaction_date, 1) OVER (PARTITION BY account_id ORDER BY transaction_date), transaction_date)) as avg_days_between_transactions FROM transactions GROUP BY account_id;"
68. How do you find suppliers who have not provided any products in the last year?,supplier_id = 705,SELECT supplier_id FROM suppliers WHERE supplier_id NOT IN (SELECT DISTINCT supplier_id FROM products WHERE YEAR(provided_date) = 2023);
69. How do you calculate the total expenses for each department?,"department_id = 409, total_expenses = 750000","SELECT department_id, SUM(expenses) as total_expenses FROM expenses GROUP BY department_id;"
70. How do you find the customer with the longest account history?,"customer_id = 910, account_duration = 3650","SELECT customer_id, DATEDIFF(MAX(account_end_date), MIN(account_start_date)) as account_duration FROM accounts GROUP BY customer_id ORDER BY account_duration DESC LIMIT 1;"
71. How do you retrieve the last three orders for each customer?,"customer_id = 315, order_id = 1110","SELECT customer_id, order_id FROM (SELECT customer_id, order_id, ROW_NUMBER() OVER (PARTITION BY customer_id ORDER BY order_date DESC) as rn FROM orders) as subquery WHERE rn <= 3;"
72. How do you find customers who have never returned a product?,customer_id = 512,SELECT customer_id FROM customers WHERE customer_id NOT IN (SELECT DISTINCT customer_id FROM returns);
73. How do you calculate the average number of orders per customer per month?,"month = 7, avg_orders_per_customer = 3","SELECT MONTH(order_date) as month, AVG(order_count) as avg_orders_per_customer FROM (SELECT customer_id, MONTH(order_date) as month, COUNT(order_id) as order_count FROM orders GROUP BY customer_id, month) as subquery GROUP BY month;"
74. How do you find products that have increased in price by more than 20% in the last year?,product_id = 604,"SELECT product_id FROM products WHERE (price - LAG(price, 1) OVER (PARTITION BY product_id ORDER BY price_date)) / LAG(price, 1) OVER (PARTITION BY product_id ORDER BY price_date) > 0.20;"
