Question,Expected Output,Answer (Query)
1. E-commerce Sales: Join Orders and Customers tables to get a list of orders with customer names. What happens if a customer ID in Orders doesn't exist in Customers?,"order_id = 1001, name = Alice Johnson"," SELECT Orders.order_id, Customers.name FROM Orders INNER JOIN Customers ON Orders.customer_id = Customers.id;"
2. Healthcare Records: Retrieve patient information from Patients and their respective doctor's name from Doctors table based on doctor_id. What if some patients don't have a doctor assigned (doctor_id is NULL)?,"patient_name = Alice Smith, doctor_name = Dr. Brown"," SELECT Patients.patient_name, Doctors.doctor_name FROM Patients INNER JOIN Doctors ON Patients.doctor_id = Doctors.id;"
3. Financial Transactions: List all transactions with their associated account holder's name from Transactions and AccountHolders. What if an account holder is deleted but their transactions still exist?,"transaction_id = 2001, name = Bob Williams, amount = 150.75, date = 2024-07-15"," SELECT Transactions.transaction_id, AccountHolders.name, Transactions.amount, Transactions.date FROM Transactions INNER JOIN AccountHolders ON Transactions.account_holder_id = AccountHolders.id;"
4. Retail Billing: Combine Bills and Products tables to display each billed product name and its price. What happens if a bill references a product that no longer exists?,"bill_id = 3001, product_name = Widget, price = 19.99, quantity = 2"," SELECT Bills.bill_id, Products.product_name, Products.price, Bills.quantity FROM Bills INNER JOIN Products ON Bills.product_id = Products.id;"
"5. Big Data Filtering: In a data warehouse, join Clicks and Users tables to analyze clicks by user demographics. What if some clicks are by unregistered users?","click_id = 4001, age = 28, gender = F, timestamp = 2024-08-01 14:32:00"," SELECT Clicks.click_id, Users.age, Users.gender, Clicks.timestamp FROM Clicks INNER JOIN Users ON Clicks.user_id = Users.id;"
6. Manufacturing Industry: Retrieve machine maintenance records from Maintenance and the machine details from Machines table. What happens if a maintenance record references a machine that's no longer in use?,"record_id = 5001, machine_name = Lathe, date = 2024-07-20, cost = 200.00"," SELECT Maintenance.record_id, Machines.machine_name, Maintenance.date, Maintenance.cost FROM Maintenance INNER JOIN Machines ON Maintenance.machine_id = Machines.id;"
7. Education System: Get a list of students and their enrolled courses from Enrollments and Courses tables. What if a course ID in Enrollments doesn't match any course in Courses?,"student_id = 6001, course_name = Math 101, enrollment_date = 2024-08-01"," SELECT Enrollments.student_id, Courses.course_name, Enrollments.enrollment_date FROM Enrollments INNER JOIN Courses ON Enrollments.course_id = Courses.id;"
8. Hospitality Management: Combine Reservations and Rooms to show each reservation with room details. What if a reservation references a room that has been removed from the system?,"reservation_id = 7001, room_type = Suite, check_in_date = 2024-08-05, check_out_date = 2024-08-12"," SELECT Reservations.reservation_id, Rooms.room_type, Reservations.check_in_date, Reservations.check_out_date FROM Reservations INNER JOIN Rooms ON Reservations.room_id = Rooms.id;"
9. Logistics: Display shipments and their corresponding destination details by joining Shipments and Destinations. What happens if some shipments have invalid or NULL destination IDs?,"shipment_id = 8001, location = San Francisco, weight = 50.0, shipment_date = 2024-07-30"," SELECT Shipments.shipment_id, Destinations.location, Shipments.weight, Shipments.shipment_date FROM Shipments INNER JOIN Destinations ON Shipments.destination_id = Destinations.id;"
10. Tech Support: Retrieve support tickets and their assigned technician's name from Tickets and Technicians. What if some tickets don't have a technician assigned (technician_id is NULL)?,"ticket_id = 9001, technician_name = Jane Doe, issue_description = System crash, created_date = 2024-08-01"," SELECT Tickets.ticket_id, Technicians.technician_name, Tickets.issue_description, Tickets.created_date FROM Tickets INNER JOIN Technicians ON Tickets.technician_id = Technicians.id;"
11. Library System: Join Books and Authors to list book titles along with their authors. What if some books have no assigned author?,"title = ""The Great Gatsby"", name = ""F. Scott Fitzgerald"""," SELECT Books.title, Authors.name FROM Books INNER JOIN Authors ON Books.author_id = Authors.id;"
12. Online Courses: Retrieve student names and their enrolled courses from StudentEnrollments and Courses. What if some students are not enrolled in any courses?,"name = ""Emma Davis"", course_name = ""Introduction to Data Science"""," SELECT Students.name, Courses.course_name FROM StudentEnrollments INNER JOIN Courses ON StudentEnrollments.course_id = Courses.id INNER JOIN Students ON StudentEnrollments.student_id = Students.id;"
13. Sales Orders: Get a list of sales orders and the sales representative handling each order from SalesOrders and SalesReps. What if an order has no assigned sales rep?,"order_id = 1501, rep_name = ""Sarah Lee"""," SELECT SalesOrders.order_id, SalesReps.rep_name FROM SalesOrders INNER JOIN SalesReps ON SalesOrders.rep_id = SalesReps.id;"
14. Product Inventory: Join Inventory and Products to list product names and their current stock levels. What happens if a product in inventory is no longer listed in the Products table?,"product_id = 301, product_name = ""Smartphone"", stock_level = 25"," SELECT Inventory.product_id, Products.product_name, Inventory.stock_level FROM Inventory INNER JOIN Products ON Inventory.product_id = Products.id;"
15. Customer Support: Combine Tickets and SupportAgents to show ticket details with the assigned agent's name. What if some tickets do not have an assigned agent?,"ticket_id = 1010, agent_name = ""Tom Harris"", issue = ""Login issue"""," SELECT Tickets.ticket_id, SupportAgents.agent_name, Tickets.issue FROM Tickets INNER JOIN SupportAgents ON Tickets.agent_id = SupportAgents.id;"
16. Movie Database: Join Movies and Directors to list movie titles and their directors. What if some movies do not have a director assigned?,"title = ""Inception"", director_name = ""Christopher Nolan"""," SELECT Movies.title, Directors.director_name FROM Movies INNER JOIN Directors ON Movies.director_id = Directors.id;"
17. Employee Projects: Get a list of employees and their projects from Employees and Projects. What if some employees are not assigned to any projects?,"name = ""John Smith"", project_name = ""Website Redesign"""," SELECT Employees.name, Projects.project_name FROM EmployeeProjects INNER JOIN Projects ON EmployeeProjects.project_id = Projects.id INNER JOIN Employees ON EmployeeProjects.employee_id = Employees.id;"
18. Event Registrations: Join Registrations and Events to show each registration with event details. What if some registrations reference events that no longer exist?,"registration_id = 5001, event_name = ""Tech Conference"", registration_date = ""2024-08-10"""," SELECT Registrations.registration_id, Events.event_name, Registrations.registration_date FROM Registrations INNER JOIN Events ON Registrations.event_id = Events.id;"
19. Real Estate Listings: Retrieve property details and their respective agents from Properties and Agents. What if some properties are not currently listed with any agents?,"address = ""123 Elm St"", agent_name = ""Laura Chen"""," SELECT Properties.address, Agents.agent_name FROM Properties INNER JOIN Agents ON Properties.agent_id = Agents.id;"
20. Gym Memberships: Combine Memberships and Members to list each membership type with member details. What happens if a membership type does not have a corresponding member?,"membership_id = 7001, member_name = ""Emily Johnson"", type = ""Premium"""," SELECT Memberships.membership_id, Members.member_name, Memberships.type FROM Memberships INNER JOIN Members ON Memberships.member_id = Members.id;"
21. Car Rentals: Join Rentals and Cars to display rental records along with car details. What if a rental record references a car that has been removed?,"`rental_id = 8001, car_model = ""Toyota Camry"," SELECT Rentals.rental_id, Cars.car_model, Rentals.rental_date FROM Rentals INNER JOIN Cars ON Rentals.car_id = Cars.id;"
How do you find the total sales in a financial database?,SUM(sales_amount) = 150000,SELECT SUM(sales_amount) FROM sales;
2. How do you calculate the average salary of employees in a company?,AVG(salary) = 55000,SELECT AVG(salary) FROM employees;
3. How do you count the number of transactions in a financial year?,COUNT(transaction_id) = 12000,SELECT COUNT(transaction_id) FROM transactions WHERE YEAR(transaction_date) = 2023;
4. How do you find the maximum transaction amount in a day?,MAX(amount) = 5000,SELECT MAX(amount) FROM transactions WHERE transaction_date = '2023-08-01';
5. How do you find the minimum balance in accounts?,MIN(balance) = 50,SELECT MIN(balance) FROM accounts;
6. How do you find customers who made no transactions in a month?,customer_id = 102,SELECT customer_id FROM customers WHERE customer_id NOT IN (SELECT DISTINCT customer_id FROM transactions WHERE MONTH(transaction_date) = 8);
7. How do you retrieve customers and their total transaction amounts?,"customer_id = 201, SUM(amount) = 10000","SELECT customer_id, SUM(amount) FROM transactions GROUP BY customer_id;"
8. How do you find the top 5 highest earning products?,"product_id = 301, total_sales = 200000","SELECT product_id, SUM(sales) as total_sales FROM sales GROUP BY product_id ORDER BY total_sales DESC LIMIT 5;"
9. How do you get the top 10 customers by transaction count?,"customer_id = 202, transaction_count = 25","SELECT customer_id, COUNT(transaction_id) as transaction_count FROM transactions GROUP BY customer_id ORDER BY transaction_count DESC LIMIT 10;"
10. How do you join customers and orders tables to get customer order details?,"name = John Doe, order_id = 1001","SELECT customers.name, orders.order_id FROM customers INNER JOIN orders ON customers.customer_id = orders.customer_id;"
11. How do you find customers who placed orders in both 2022 and 2023?,customer_id = 303,SELECT DISTINCT customer_id FROM orders WHERE YEAR(order_date) = 2022 INTERSECT SELECT DISTINCT customer_id FROM orders WHERE YEAR(order_date) = 2023;
12. How do you find the number of employees in each department?,"department_id = 401, COUNT(employee_id) = 50","SELECT department_id, COUNT(employee_id) FROM employees GROUP BY department_id;"
13. How do you retrieve employee names with salaries above average?,name = Jane Smith,SELECT name FROM employees WHERE salary > (SELECT AVG(salary) FROM employees);
14. How do you calculate the total salary expenses for each department?,"department_id = 402, SUM(salary) = 2500000","SELECT department_id, SUM(salary) FROM employees GROUP BY department_id;"
15. How do you find the second highest salary in the company?,MAX(salary) = 120000,SELECT MAX(salary) FROM employees WHERE salary < (SELECT MAX(salary) FROM employees);
16. How do you retrieve all orders made in the last 7 days?,"order_id = 1050, order_date = '2023-08-01'",SELECT * FROM orders WHERE order_date >= CURDATE() - INTERVAL 7 DAY;
17. How do you identify duplicate records in a table?,"column1 = A, column2 = B, COUNT(*) = 2","SELECT column1, column2, COUNT(*) FROM table_name GROUP BY column1, column2 HAVING COUNT(*) > 1;"
18. How do you calculate the monthly revenue for the year 2023?,"month = 7, monthly_revenue = 300000","SELECT MONTH(transaction_date) as month, SUM(amount) as monthly_revenue FROM transactions WHERE YEAR(transaction_date) = 2023 GROUP BY month;"
19. How do you find the number of active customers in the last 30 days?,COUNT(DISTINCT customer_id) = 500,SELECT COUNT(DISTINCT customer_id) FROM transactions WHERE transaction_date >= CURDATE() - INTERVAL 30 DAY;
20. How do you find the transaction count per customer in a specific region?,"customer_id = 501, COUNT(transaction_id) = 15","SELECT customer_id, COUNT(transaction_id) FROM transactions WHERE region = 'North' GROUP BY customer_id;"
21. How do you update the status of all transactions above $1000 to 'High'?,Rows updated,UPDATE transactions SET status = 'High' WHERE amount > 1000;
22. How do you find the percentage of transactions above $500?,percentage_above_500 = 40.0,SELECT (COUNT(*) FILTER (WHERE amount > 500) / COUNT(*)) * 100 as percentage_above_500 FROM transactions;
23. How do you retrieve customers with more than three transactions?,customer_id = 601,SELECT customer_id FROM transactions GROUP BY customer_id HAVING COUNT(transaction_id) > 3;
24. How do you calculate the difference between maximum and minimum transaction amounts for each customer?,"customer_id = 701, amount_difference = 4500","SELECT customer_id, MAX(amount) - MIN(amount) as amount_difference FROM transactions GROUP BY customer_id;"
25. How do you select all columns from a table?,All columns and rows displayed,SELECT * FROM table_name;
26. How do you select specific columns from a table?,"column1, column2","SELECT column1, column2 FROM table_name;"
27. How do you sort records in SQL?,Sorted records,`SELECT * FROM table_name ORDER BY column1 ASC
28. How do you group records in SQL?,Grouped records,"SELECT column1, COUNT(*) FROM table_name GROUP BY column1;"
29. What is the purpose of the HAVING clause?,Filtered aggregate records,"SELECT column1, COUNT(*) FROM table_name GROUP BY column1 HAVING COUNT(*) > 1;"
30. How do you find the top 5 highest earning products by category?,"category = Electronics, total_sales = 500000","SELECT category, SUM(sales) as total_sales FROM sales GROUP BY category ORDER BY total_sales DESC LIMIT 5;"
31. How do you retrieve customer names with orders over $1000?,"customer_name = Alice, order_amount = 1500","SELECT customers.name, orders.order_amount FROM customers INNER JOIN orders ON customers.customer_id = orders.customer_id WHERE orders.order_amount > 1000;"
32. How do you find the number of employees in each city?,"city = New York, COUNT(employee_id) = 100","SELECT city, COUNT(employee_id) FROM employees GROUP BY city;"
33. How do you calculate the average order value per customer?,"customer_id = 304, AVG(order_value) = 250","SELECT customer_id, AVG(order_value) FROM orders GROUP BY customer_id;"
34. How do you retrieve products with a price above average?,"product_name = Laptop, price = 1200","SELECT product_name, price FROM products WHERE price > (SELECT AVG(price) FROM products);"
35. How do you find the total transaction count for each payment method?,"payment_method = Credit Card, COUNT(*) = 5000","SELECT payment_method, COUNT(*) FROM transactions GROUP BY payment_method;"
36. How do you find customers with no orders in the last year?,customer_id = 102,SELECT customer_id FROM customers WHERE customer_id NOT IN (SELECT DISTINCT customer_id FROM orders WHERE YEAR(order_date) = 2023);
37. How do you find the largest order for each customer?,"customer_id = 205, MAX(order_value) = 2500","SELECT customer_id, MAX(order_value) FROM orders GROUP BY customer_id;"
38. How do you find the customers who ordered the most in 2023?,"customer_id = 302, total_orders = 20","`SELECT customer_id, COUNT(order_id) as total_orders"
22. Customer Orders: Join Orders and Customers to show each order with the customer's contact details. What if some orders have no associated customer?,"order_id = 1101, contact_info = ""john.doe@example.com"""," SELECT Orders.order_id, Customers.contact_info FROM Orders INNER JOIN Customers ON Orders.customer_id = Customers.id;"
23. Hotel Bookings: Retrieve booking information from Bookings and Rooms to show each booking with room details. What if some bookings are for rooms that no longer exist?,"booking_id = 1201, room_type = ""Deluxe"", check_in_date = ""2024-08-15"""," SELECT Bookings.booking_id, Rooms.room_type, Bookings.check_in_date FROM Bookings INNER JOIN Rooms ON Bookings.room_id = Rooms.id;"
24. Research Projects: Combine Projects and Researchers to list project names with the names of researchers. What if some projects do not have any assigned researchers?,"project_name = ""AI for Healthcare"", researcher_name = ""Dr. Emily Adams"""," SELECT Projects.project_name, Researchers.researcher_name FROM Projects INNER JOIN Researchers ON Projects.researcher_id = Researchers.id;"
25. Product Reviews: Join Reviews and Products to show each review with product details. What happens if some reviews reference products that are no longer available?,"review_id = 1301, product_name = ""Laptop Pro"", rating = 4.5"," SELECT Reviews.review_id, Products.product_name, Reviews.rating FROM Reviews INNER JOIN Products ON Reviews.product_id = Products.id;"
26. Transportation Logistics: Retrieve shipment details from Shipments and Transporters to show each shipment with transporter information. What if some shipments have no assigned transporter?,"shipment_id = 1401, transporter_name = ""Global Freight"", delivery_date = ""2024-08-20"""," SELECT Shipments.shipment_id, Transporters.transporter_name, Shipments.delivery_date FROM Shipments INNER JOIN Transporters ON Shipments.transporter_id = Transporters.id;"
27. Event Attendees: Join EventAttendees and Events to list attendee names with event details. What if some attendees are not registered for any event?,"attendee_name = ""David Brown"", event_name = ""Networking Gala"""," SELECT EventAttendees.attendee_name, Events.event_name FROM EventAttendees INNER JOIN Events ON EventAttendees.event_id = Events.id;"
28. Supplier Orders: Combine SupplierOrders and Suppliers to show each order along with supplier details. What if some orders are from suppliers who are no longer in the system?,"order_id = 1501, supplier_name = ""ABC Supplies"", order_date = ""2024-08-01"""," SELECT SupplierOrders.order_id, Suppliers.supplier_name, SupplierOrders.order_date FROM SupplierOrders INNER JOIN Suppliers ON SupplierOrders.supplier_id = Suppliers.id;"
29. Job Applications: Retrieve applicant details from Applications and Jobs to show each application with job details. What if some applications refer to jobs that are no longer available?,"application_id = 1601, job_title = ""Software Engineer"", application_date = ""2024-07-30"""," SELECT Applications.application_id, Jobs.job_title, Applications.application_date FROM Applications INNER JOIN Jobs ON Applications.job_id = Jobs.id;"
30. Course Enrollments: Join CourseEnrollments and Courses to list enrolled students with their course details. What if some enrollments refer to courses that have been deleted?,"student_id = 1701, course_name = ""Introduction to AI"", enrollment_date = ""2024-08-01"""," SELECT CourseEnrollments.student_id, Courses.course_name, CourseEnrollments.enrollment_date FROM CourseEnrollments INNER JOIN Courses ON CourseEnrollments.course_id = Courses.id;"
31. Library Transactions: Combine LibraryTransactions and Books to show each transaction with book details. What happens if some transactions reference books that have been removed?,"transaction_id = 1801, title = ""1984"", transaction_date = ""2024-08-05"""," SELECT LibraryTransactions.transaction_id, Books.title, LibraryTransactions.transaction_date FROM LibraryTransactions INNER JOIN Books ON LibraryTransactions.book_id = Books.id;"
39. How do you calculate the total revenue by quarter for 2023?,"quarter = Q1, total_revenue = 1000000","SELECT QUARTER(transaction_date) as quarter, SUM(amount) as total_revenue FROM transactions WHERE YEAR(transaction_date) = 2023 GROUP BY quarter;"
40. How do you find employees hired in the last 6 months?,"employee_id = 406, hire_date = '2023-03-01'",SELECT * FROM employees WHERE hire_date >= CURDATE() - INTERVAL 6 MONTH;
41. How do you retrieve orders shipped in a specific region?,"order_id = 1080, region = West",SELECT * FROM orders WHERE region = 'West';
42. How do you find the customer with the highest number of returns?,"customer_id = 505, return_count = 15","SELECT customer_id, COUNT(return_id) as return_count FROM returns GROUP BY customer_id ORDER BY return_count DESC LIMIT 1;"
43. How do you find the average time between orders for each customer?,"customer_id = 306, avg_days_between_orders = 30","SELECT customer_id, AVG(DATEDIFF(LEAD(order_date, 1) OVER (PARTITION BY customer_id ORDER BY order_date), order_date)) as avg_days_between_orders FROM orders GROUP BY customer_id;"
44. How do you find the most common product category?,"category = Apparel, count = 1000","SELECT category, COUNT(*) as count FROM products GROUP BY category ORDER BY count DESC LIMIT 1;"
45. How do you find orders with a delivery date after the estimated date?,"order_id = 1100, delivery_date = '2023-08-05'",SELECT * FROM orders WHERE delivery_date > estimated_delivery_date;
46. How do you identify products with decreasing sales over three months?,"product_id = 402, decreasing_sales = true",SELECT product_id FROM sales WHERE sales_date >= CURDATE() - INTERVAL 3 MONTH GROUP BY product_id HAVING SUM(sales) < (SELECT SUM(sales) FROM sales WHERE sales_date >= CURDATE() - INTERVAL 6 MONTH AND sales_date < CURDATE() - INTERVAL 3 MONTH GROUP BY product_id);
47. How do you find the employees who manage the most projects?,"employee_id = 508, project_count = 8","SELECT manager_id, COUNT(project_id) as project_count FROM projects GROUP BY manager_id ORDER BY project_count DESC LIMIT 1;"
48. How do you find the total number of products sold in each category?,"category = Home Goods, total_sold = 15000","SELECT category, SUM(quantity_sold) as total_sold FROM sales GROUP BY category;"
49. How do you find the suppliers who provide the highest number of products?,"supplier_id = 610, product_count = 300","SELECT supplier_id, COUNT(product_id) as product_count FROM products GROUP BY supplier_id ORDER BY product_count DESC LIMIT 1;"
50. How do you calculate the customer lifetime value (CLV)?,"customer_id = 102, CLV = 5000","SELECT customer_id, SUM(amount) as CLV FROM transactions GROUP BY customer_id;"
32. Order Details: Join Orders and Products to show order details with product names.,"order_id = 2001, product_name = ""Bluetooth Speaker"""," SELECT Orders.order_id, Products.product_name FROM Orders INNER JOIN Products ON Orders.product_id = Products.id;"
33. Student Grades: Combine Grades and Students to show student names and their grades.,"student_name = ""Jake White"", grade = ""A"""," SELECT Students.name, Grades.grade FROM Grades INNER JOIN Students ON Grades.student_id = Students.id;"
34. Customer Addresses: List customer orders and their addresses.,"order_id = 2101, address = ""123 Maple Ave"""," SELECT Orders.order_id, Customers.address FROM Orders INNER JOIN Customers ON Orders.customer_id = Customers.id;"
35. Product Suppliers: Get product names and their suppliers.,"product_name = ""Smartwatch"", supplier_name = ""TechSupply Inc."""," SELECT Products.product_name, Suppliers.supplier_name FROM Products INNER JOIN Suppliers ON Products.supplier_id = Suppliers.id;"
36. Rental Equipment: Show rentals with equipment details.,"rental_id = 2201, equipment_name = ""Projector"""," SELECT Rentals.rental_id, Equipment.equipment_name FROM Rentals INNER JOIN Equipment ON Rentals.equipment_id = Equipment.id;"
37. Event Registrations: List registrants and their events.,"registrant_name = ""Sara Miller"", event_name = ""Annual Gala"""," SELECT Registrants.name, Events.event_name FROM Registrants INNER JOIN Events ON Registrants.event_id = Events.id;"
38. Employee Departments: Show employees and their departments.,"employee_name = ""Michael Green"", department_name = ""Marketing"""," SELECT Employees.name, Departments.department_name FROM Employees INNER JOIN Departments ON Employees.department_id = Departments.id;"
39. Library Books: Join Books and Authors to list books and their authors.,"book_title = ""War and Peace"", author_name = ""Leo Tolstoy"""," SELECT Books.title, Authors.name FROM Books INNER JOIN Authors ON Books.author_id = Authors.id;"
40. Order Payments: Retrieve orders with payment information.,"order_id = 2301, payment_amount = ""$150.00"""," SELECT Orders.order_id, Payments.amount FROM Orders INNER JOIN Payments ON Orders.payment_id = Payments.id;"
41. Conference Speakers: Show conference details with speaker names.,"conference_name = ""Tech Innovators"", speaker_name = ""Dr. Alan Smith"""," SELECT Conferences.name, Speakers.speaker_name FROM Conferences INNER JOIN Speakers ON Conferences.speaker_id = Speakers.id;"
42. Delivery Shipments: Join Deliveries and Shipments to show delivery details with shipment info.,"delivery_id = 2401, shipment_details = ""2 boxes, Fragile"""," SELECT Deliveries.delivery_id, Shipments.details FROM Deliveries INNER JOIN Shipments ON Deliveries.shipment_id = Shipments.id;"
43. Customer Reviews: List customer reviews with product names.,"review_id = 2501, product_name = ""Air Purifier"", review_rating = ""5 stars"""," SELECT Reviews.review_id, Products.product_name, Reviews.rating FROM Reviews INNER JOIN Products ON Reviews.product_id = Products.id;"
44. Employee Salaries: Retrieve employee salaries and their departments.,"employee_name = ""Sophia Clark"", salary = ""$85,000"""," SELECT Employees.name, Employees.salary, Departments.department_name FROM Employees INNER JOIN Departments ON Employees.department_id = Departments.id;"
45. Sales Data: Show sales and their respective products.,"sale_id = 2601, product_name = ""Electric Drill"", quantity_sold = 5"," SELECT Sales.sale_id, Products.product_name, Sales.quantity FROM Sales INNER JOIN Products ON Sales.product_id = Products.id;"
